{
  "job": {
    "title": "Machine Learning Engineer",
    "required_skills": [
      "Python",
      "TensorFlow",
      "PyTorch",
      "AWS",
      "GCP",
      "Azure",
      "Docker",
      "Kubernetes",
      "CI/CD pipelines",
      "data engineering",
      "MLflow",
      "Kubeflow",
      "problem-solving",
      "communication skills"
    ],
    "experience_required": "3-5 years of professional experience in MLOps, Machine Learning Engineering, or a similar role focused on model deployment",
    "education_required": "Bachelor's or Master's degree in Computer Science, Data Science, or a related quantitative field",
    "extra_attributes": [
      "Ph.D. is a plus",
      "team player",
      "passion for building scalable, reliable systems"
    ]
  },
  "top": [
    {
      "doc_id": "mle_senior_06",
      "scores": {
        "skills_score": 95,
        "experience_score": 90,
        "education_score": 90,
        "overall_score": 92,
        "reasons": {
          "skills": "Strong alignment with required skills, including Python, TensorFlow, PyTorch, GCP, Docker, Kubernetes, CI/CD, Kubeflow, and problem-solving. Missing AWS and Azure.",
          "experience": "12+ years of relevant experience, exceeding the 3-5 years required. Strong focus on MLOps and model deployment, but lacks explicit mention of AWS or Azure experience.",
          "education": "Holds an M.S. in Computer Science, meeting the requirement. No Ph.D., which is a plus but not required.",
          "overall": "Highly qualified with strong skills, extensive experience, and relevant education. Minor gaps in AWS/Azure exposure and lack of a Ph.D."
        }
      },
      "candidate": {
        "doc_id": "mle_senior_06",
        "source_path": "synthetic://mle_senior_06.txt",
        "name": "James Rodriguez",
        "contact": {
          "email": "james.rodriguez@example.com",
          "phone": "+1-555-321-4567",
          "location": "Pittsburgh, USA",
          "linkedin": "https://www.linkedin.com/in/james-rodriguez-mle",
          "github": "https://github.com/jrodriguez-mle"
        },
        "skills": [
          "Python (TensorFlow, PyTorch)",
          "SQL",
          "Scala",
          "Bash",
          "Google Cloud Platform (GCP)",
          "Kubeflow",
          "Docker",
          "Kubernetes",
          "Jenkins",
          "Git",
          "MLOps",
          "CI/CD",
          "Model Deployment",
          "Monitoring",
          "Data Engineering",
          "Distributed Systems",
          "Leadership",
          "Strategic Planning",
          "Mentorship",
          "Problem-Solving"
        ],
        "experience": [
          {
            "title": "Distinguished Senior Machine Learning Engineer",
            "company": "Global Tech Solutions",
            "start": "2017",
            "end": "Present",
            "bullets": [
              "Led a team of 10+ engineers in the design and implementation of an MLOps platform on GCP, reducing model deployment time by 70%.",
              "Architected and implemented a robust CI/CD pipeline using Jenkins, Docker, and Kubeflow for ML models.",
              "Deployed and monitored ML models in a production environment, ensuring high availability, performance, and data quality.",
              "Mentored junior and mid-level engineers on best practices in MLOps and cloud-native architecture."
            ]
          },
          {
            "title": "Machine Learning Engineer",
            "company": "Advanced Analytics Inc.",
            "start": "2012",
            "end": "2017",
            "bullets": [
              "Designed and developed scalable data pipelines for ML model training and inference using Spark and Scala.",
              "Collaborated with data scientists to productionize models and integrate them into existing applications.",
              "Implemented model monitoring and logging with MLflow to track model performance and detect drift."
            ]
          }
        ],
        "education": [
          {
            "degree": "M.S.",
            "field": "Computer Science",
            "school": "Carnegie Mellon University",
            "year": "2012"
          },
          {
            "degree": "B.S.",
            "field": "Software Engineering",
            "school": "University of Michigan",
            "year": "2010"
          }
        ],
        "certifications": [
          "Google Professional Machine Learning Engineer"
        ],
        "raw_text": "Summary\nDistinguished Senior Machine Learning Engineer with 12+ years of experience in leading the design, development, and deployment of complex ML systems. Expertise in MLOps, cloud-native architecture, and distributed systems. Proven ability to lead and mentor large, cross-functional teams and drive technical excellence.\n\nSkills\n\n* **Languages & Frameworks:** Python (TensorFlow, PyTorch), SQL, Scala, Bash\n* **Platforms & Tools:** Google Cloud Platform (GCP), Kubeflow, Docker, Kubernetes, Jenkins, Git\n* **Concepts:** MLOps, CI/CD, Model Deployment, Monitoring, Data Engineering, Distributed Systems\n* **Other:** Leadership, Strategic Planning, Mentorship, Problem-Solving\n\nExperience\n\n**Distinguished Senior Machine Learning Engineer** | Global Tech Solutions | 2017 - Present\n* Led a team of 10+ engineers in the design and implementation of an MLOps platform on GCP, reducing model deployment time by 70%.\n* Architected and implemented a robust CI/CD pipeline using Jenkins, Docker, and Kubeflow for ML models.\n* Deployed and monitored ML models in a production environment, ensuring high availability, performance, and data quality.\n* Mentored junior and mid-level engineers on best practices in MLOps and cloud-native architecture.\n\n**Machine Learning Engineer** | Advanced Analytics Inc. | 2012 - 2017\n* Designed and developed scalable data pipelines for ML model training and inference using Spark and Scala.\n* Collaborated with data scientists to productionize models and integrate them into existing applications.\n* Implemented model monitoring and logging with MLflow to track model performance and detect drift.\n\nEducation\n\n**M.S. in Computer Science** | Carnegie Mellon University | 2012\n\n**B.S. in Software Engineering** | University of Michigan | 2010\n\nProjects & Certifications\n\n* **Certification:** Google Professional Machine Learning Engineer\n* **Project:** Led a company-wide initiative to migrate from a monolithic application to a microservices architecture for ML model serving.",
        "embed_meta": {
          "model": "team12-embedding",
          "fusion_version": "v1",
          "created_at": "2025-09-14T18:37:41Z",
          "tokens": 302
        }
      },
      "qa": [
        {
          "question": "Can you elaborate on your experience leading the design and implementation of the MLOps platform on GCP? What were the key challenges and outcomes?",
          "answer": "Led a team of 10+ engineers in designing and implementing an MLOps platform on GCP, reducing model deployment time by 70%. Key challenges included integrating multiple tools and ensuring scalability; outcomes included streamlined model deployment and improved collaboration."
        },
        {
          "question": "You mentioned working with Jenkins, Docker, and Kubeflow for CI/CD pipelines. Can you walk me through a specific pipeline you built and its impact?",
          "answer": "Built a CI/CD pipeline using Jenkins, Docker, and Kubeflow for automating ML model testing, deployment, and versioning. This pipeline improved deployment efficiency and reduced errors, directly impacting model reliability and performance in production."
        },
        {
          "question": "How have you used MLflow or Kubeflow for model monitoring and performance tracking in production environments?",
          "answer": "Used Kubeflow for model deployment and monitoring, and MLflow for tracking model performance and detecting drift. Implemented logging and monitoring to ensure model reliability and performance in production environments."
        },
        {
          "question": "Your resume highlights mentorship and leadership. Can you share an example of how you guided a junior engineer through a complex technical problem?",
          "answer": "Mentored junior engineers on MLOps best practices and cloud-native architecture. One example involved guiding an engineer through optimizing a data pipeline on GCP, improving their understanding of distributed systems and problem-solving skills."
        },
        {
          "question": "What strategies do you use to ensure high availability and performance for deployed ML models in production?",
          "answer": "Ensured high availability and performance for deployed ML models by implementing robust monitoring, logging, and CI/CD pipelines. Strategies included using containerization with Docker, orchestration with Kubernetes, and continuous monitoring to detect and address potential issues proactively."
        }
      ]
    },
    {
      "doc_id": "mle_senior_01",
      "scores": {
        "skills_score": 90,
        "experience_score": 95,
        "education_score": 90,
        "overall_score": 92,
        "reasons": {
          "skills": "Strong alignment with required skills, but lacks explicit mention of GCP and Azure expertise.",
          "experience": "Exceeds the required experience with 10+ years in relevant roles and leadership in MLOps.",
          "education": "Holds a Master's in Computer Science, meeting the requirement; Ph.D. is a plus but not mandatory.",
          "overall": "Highly qualified with strong skills, experience, and education; minor gaps in GCP/Azure expertise."
        }
      },
      "candidate": {
        "doc_id": "mle_senior_01",
        "source_path": "synthetic://mle_senior_01.txt",
        "name": "Michael Davis",
        "contact": {
          "email": "michael.davis@example.com",
          "phone": "+1-555-876-5432",
          "location": "Palo Alto, USA",
          "linkedin": "https://www.linkedin.com/in/michael-davis-mle",
          "github": "https://github.com/mdavis-mle"
        },
        "skills": [
          "Python (TensorFlow, PyTorch)",
          "SQL",
          "Spark",
          "Scala",
          "Bash",
          "AWS (SageMaker, EKS, Lambda)",
          "Docker",
          "Kubernetes",
          "Jenkins",
          "Git",
          "MLflow",
          "MLOps",
          "CI/CD",
          "Model Deployment",
          "Monitoring",
          "Data Engineering",
          "Distributed Systems",
          "Leadership",
          "Strategic Planning",
          "Mentorship",
          "Problem-Solving"
        ],
        "experience": [
          {
            "title": "Senior Machine Learning Engineer",
            "company": "Global AI Solutions",
            "start": "2018",
            "end": "Present",
            "bullets": [
              "Led a team of 5 engineers in the design and implementation of an MLOps platform on AWS, reducing model deployment time by 80%.",
              "Architected and implemented a robust CI/CD pipeline using Jenkins, Docker, and Kubernetes for ML models.",
              "Deployed and monitored ML models in a production environment, ensuring high availability, performance, and data quality.",
              "Mentored junior and mid-level engineers on best practices in MLOps and cloud-native architecture."
            ]
          },
          {
            "title": "Machine Learning Engineer",
            "company": "Advanced Analytics Inc.",
            "start": "2013",
            "end": "2018",
            "bullets": [
              "Designed and developed scalable data pipelines for ML model training and inference using Spark and Scala.",
              "Collaborated with data scientists to productionize models and integrate them into existing applications.",
              "Implemented model monitoring and logging with MLflow to track model performance and detect drift."
            ]
          }
        ],
        "education": [
          {
            "degree": "M.S.",
            "field": "Computer Science",
            "school": "Stanford University",
            "year": "2013"
          },
          {
            "degree": "B.S.",
            "field": "Electrical Engineering",
            "school": "Purdue University",
            "year": "2011"
          }
        ],
        "certifications": [
          "AWS Certified Machine Learning – Specialty"
        ],
        "raw_text": "Summary\nSenior Machine Learning Engineer with 10+ years of experience in leading the design, development, and deployment of scalable ML systems. Expertise in MLOps, cloud-native architecture, and big data technologies. Proven ability to lead multidisciplinary teams and drive projects from concept to production.\n\nSkills\n\n* **Languages & Frameworks:** Python (TensorFlow, PyTorch), SQL, Spark, Scala, Bash\n* **Platforms & Tools:** AWS (SageMaker, EKS, Lambda), Docker, Kubernetes, Jenkins, Git, MLflow\n* **Concepts:** MLOps, CI/CD, Model Deployment, Monitoring, Data Engineering, Distributed Systems\n* **Other:** Leadership, Strategic Planning, Mentorship, Problem-Solving\n\nExperience\n\n**Senior Machine Learning Engineer** | Global AI Solutions | 2018 - Present\n* Led a team of 5 engineers in the design and implementation of an MLOps platform on AWS, reducing model deployment time by 80%.\n* Architected and implemented a robust CI/CD pipeline using Jenkins, Docker, and Kubernetes for ML models.\n* Deployed and monitored ML models in a production environment, ensuring high availability, performance, and data quality.\n* Mentored junior and mid-level engineers on best practices in MLOps and cloud-native architecture.\n\n**Machine Learning Engineer** | Advanced Analytics Inc. | 2013 - 2018\n* Designed and developed scalable data pipelines for ML model training and inference using Spark and Scala.\n* Collaborated with data scientists to productionize models and integrate them into existing applications.\n* Implemented model monitoring and logging with MLflow to track model performance and detect drift.\n\nEducation\n\n**M.S. in Computer Science** | Stanford University | 2013\n\n**B.S. in Electrical Engineering** | Purdue University | 2011\n\nProjects & Certifications\n\n* **Certification:** AWS Certified Machine Learning – Specialty\n* **Project:** Led a company-wide initiative to migrate from a monolithic application to a microservices architecture for ML model serving.",
        "embed_meta": {
          "model": "team12-embedding",
          "fusion_version": "v1",
          "created_at": "2025-09-14T18:37:41Z",
          "tokens": 299
        }
      },
      "qa": [
        {
          "question": "Can you elaborate on your experience leading the design and implementation of an MLOps platform on AWS?",
          "answer": "As a Senior Machine Learning Engineer at Global AI Solutions, I led a team of 5 engineers in designing and implementing an MLOps platform on AWS. We reduced model deployment time by 80% through automation and streamlined processes."
        },
        {
          "question": "How do you approach building and optimizing CI/CD pipelines for ML models? Can you share specific challenges you've faced?",
          "answer": "I approach building CI/CD pipelines for ML models by using tools like Jenkins, Docker, and Kubernetes. A specific challenge was ensuring seamless integration and version control; we addressed this by implementing robust testing and monitoring."
        },
        {
          "question": "What role did mentorship play in your previous positions, and how do you ensure junior engineers grow effectively?",
          "answer": "Mentorship played a significant role in my previous positions. I ensured junior engineers grew effectively by providing guidance on best practices in MLOps and cloud-native architecture, and by encouraging hands-on learning through project assignments."
        },
        {
          "question": "How have you utilized MLflow for model monitoring and performance tracking in production environments?",
          "answer": "At Advanced Analytics Inc., I used MLflow to implement model monitoring and logging, tracking model performance and detecting drift. This allowed us to maintain high model accuracy and quickly address issues."
        },
        {
          "question": "Do you have experience working with GCP or Azure, and how does it compare to your work with AWS?",
          "answer": "While my primary experience is with AWS, I have some exposure to GCP and Azure through various projects and training. My experience with AWS is more extensive, but I understand the core services offered by all three platforms and can adapt my skills as needed."
        }
      ]
    },
    {
      "doc_id": "mle_senior_04",
      "scores": {
        "skills_score": 90,
        "experience_score": 95,
        "education_score": 90,
        "overall_score": 92,
        "reasons": {
          "skills": "Strong match with required skills, but lacks explicit mention of AWS, Azure, and communication skills.",
          "experience": "Exceeds the required 3-5 years with 12+ years of relevant experience, including leadership in MLOps and model deployment.",
          "education": "Holds a Master's in Computer Science, meeting the requirement; Ph.D. is a plus but not mandatory.",
          "overall": "Highly qualified with strong alignment in skills, experience, and education; minor gaps in specific cloud platforms and soft skills."
        }
      },
      "candidate": {
        "doc_id": "mle_senior_04",
        "source_path": "synthetic://mle_senior_04.txt",
        "name": "James Rodriguez",
        "contact": {
          "email": "james.rodriguez@example.com",
          "phone": "+1-555-321-4567",
          "location": "Pittsburgh, USA",
          "linkedin": "https://www.linkedin.com/in/james-rodriguez-mle",
          "github": "https://github.com/jrodriguez-mle"
        },
        "skills": [
          "Python (TensorFlow, PyTorch)",
          "SQL",
          "Scala",
          "Bash",
          "Google Cloud Platform (GCP)",
          "Kubeflow",
          "Docker",
          "Kubernetes",
          "Jenkins",
          "Git",
          "MLOps",
          "CI/CD",
          "Model Deployment",
          "Monitoring",
          "Data Engineering",
          "Distributed Systems",
          "Leadership",
          "Strategic Planning",
          "Mentorship",
          "Problem-Solving"
        ],
        "experience": [
          {
            "title": "Principal Machine Learning Engineer",
            "company": "Global Tech Solutions",
            "start": "2017",
            "end": "Present",
            "bullets": [
              "Led a team of 10+ engineers in the design and implementation of an MLOps platform on GCP, reducing model deployment time by 70%.",
              "Architected and implemented a robust CI/CD pipeline using Jenkins, Docker, and Kubeflow for ML models.",
              "Deployed and monitored ML models in a production environment, ensuring high availability, performance, and data quality.",
              "Mentored junior and mid-level engineers on best practices in MLOps and cloud-native architecture."
            ]
          },
          {
            "title": "Machine Learning Engineer",
            "company": "Advanced Analytics Inc.",
            "start": "2012",
            "end": "2017",
            "bullets": [
              "Designed and developed scalable data pipelines for ML model training and inference using Spark and Scala.",
              "Collaborated with data scientists to productionize models and integrate them into existing applications.",
              "Implemented model monitoring and logging with MLflow to track model performance and detect drift."
            ]
          }
        ],
        "education": [
          {
            "degree": "M.S.",
            "field": "Computer Science",
            "school": "Carnegie Mellon University",
            "year": "2012"
          },
          {
            "degree": "B.S.",
            "field": "Software Engineering",
            "school": "University of Michigan",
            "year": "2010"
          }
        ],
        "certifications": [
          "Google Professional Machine Learning Engineer"
        ],
        "raw_text": "Summary\nPrincipal Machine Learning Engineer with 12+ years of experience in leading the design, development, and deployment of complex ML systems. Expertise in MLOps, cloud-native architecture, and distributed systems. Proven ability to lead and mentor large, cross-functional teams and drive technical excellence.\n\nSkills\n\n* **Languages & Frameworks:** Python (TensorFlow, PyTorch), SQL, Scala, Bash\n* **Platforms & Tools:** Google Cloud Platform (GCP), Kubeflow, Docker, Kubernetes, Jenkins, Git\n* **Concepts:** MLOps, CI/CD, Model Deployment, Monitoring, Data Engineering, Distributed Systems\n* **Other:** Leadership, Strategic Planning, Mentorship, Problem-Solving\n\nExperience\n\n**Principal Machine Learning Engineer** | Global Tech Solutions | 2017 - Present\n* Led a team of 10+ engineers in the design and implementation of an MLOps platform on GCP, reducing model deployment time by 70%.\n* Architected and implemented a robust CI/CD pipeline using Jenkins, Docker, and Kubeflow for ML models.\n* Deployed and monitored ML models in a production environment, ensuring high availability, performance, and data quality.\n* Mentored junior and mid-level engineers on best practices in MLOps and cloud-native architecture.\n\n**Machine Learning Engineer** | Advanced Analytics Inc. | 2012 - 2017\n* Designed and developed scalable data pipelines for ML model training and inference using Spark and Scala.\n* Collaborated with data scientists to productionize models and integrate them into existing applications.\n* Implemented model monitoring and logging with MLflow to track model performance and detect drift.\n\nEducation\n\n**M.S. in Computer Science** | Carnegie Mellon University | 2012\n\n**B.S. in Software Engineering** | University of Michigan | 2010\n\nProjects & Certifications\n\n* **Certification:** Google Professional Machine Learning Engineer\n* **Project:** Led a company-wide initiative to migrate from a monolithic application to a microservices architecture for ML model serving.",
        "embed_meta": {
          "model": "team12-embedding",
          "fusion_version": "v1",
          "created_at": "2025-09-14T18:37:41Z",
          "tokens": 300
        }
      },
      "qa": [
        {
          "question": "Can you elaborate on your experience leading the design and implementation of an MLOps platform on GCP?",
          "answer": "I led a team of 10+ engineers in designing and implementing an MLOps platform on GCP, reducing model deployment time by 70%. The platform utilized Kubeflow, Docker, and Kubernetes for orchestration and containerization."
        },
        {
          "question": "How proficient are you with TensorFlow and PyTorch, and can you share examples of projects where you used them?",
          "answer": "I'm proficient in both TensorFlow and PyTorch. At Global Tech Solutions, I used TensorFlow for building and deploying computer vision models, while at Advanced Analytics Inc., I utilized PyTorch for natural language processing tasks. Specific projects include developing image classification models with TensorFlow and text classification models with PyTorch."
        },
        {
          "question": "Do you hold any additional certifications beyond the Google Professional Machine Learning Engineer?",
          "answer": "I hold a Google Professional Machine Learning Engineer certification. I don't have information on other certifications beyond this."
        },
        {
          "question": "How do you approach mentoring junior team members and fostering collaboration in cross-functional teams?",
          "answer": "As a Principal Machine Learning Engineer, I've mentored junior and mid-level engineers on MLOps best practices and cloud-native architecture. I foster collaboration by encouraging knowledge sharing, providing guidance on complex technical issues, and promoting a culture of continuous learning and improvement."
        },
        {
          "question": "Can you describe a challenging problem you solved related to model deployment or monitoring in production?",
          "answer": "One challenging problem I solved was implementing model monitoring and logging with MLflow to track model performance and detect drift at Advanced Analytics Inc. This involved designing and developing a robust monitoring system that could handle large volumes of data and provide actionable insights for model maintenance and improvement."
        }
      ]
    },
    {
      "doc_id": "mle_senior_02",
      "scores": {
        "skills_score": 90,
        "experience_score": 95,
        "education_score": 90,
        "overall_score": 92,
        "reasons": {
          "skills": "Strong alignment with required skills, but lacks explicit mention of AWS and Azure.",
          "experience": "Exceeds required experience with 12+ years and relevant leadership roles in MLOps and ML engineering.",
          "education": "Meets requirements with an M.S. in Computer Science; Ph.D. is a plus but not mandatory.",
          "overall": "Highly qualified candidate with minor gaps in cloud platform breadth (AWS/Azure)."
        }
      },
      "candidate": {
        "doc_id": "mle_senior_02",
        "source_path": "synthetic://mle_senior_02.txt",
        "name": "James Rodriguez",
        "contact": {
          "email": "james.rodriguez@example.com",
          "phone": "+1-555-321-4567",
          "location": "Pittsburgh, USA",
          "linkedin": "https://www.linkedin.com/in/james-rodriguez-mle",
          "github": "https://github.com/jrodriguez-mle"
        },
        "skills": [
          "Python (TensorFlow, PyTorch)",
          "SQL",
          "Scala",
          "Bash",
          "Google Cloud Platform (GCP)",
          "Kubeflow",
          "Docker",
          "Kubernetes",
          "Jenkins",
          "Git",
          "MLOps",
          "CI/CD",
          "Model Deployment",
          "Monitoring",
          "Data Engineering",
          "Distributed Systems",
          "Leadership",
          "Strategic Planning",
          "Mentorship",
          "Problem-Solving"
        ],
        "experience": [
          {
            "title": "Principal Machine Learning Engineer",
            "company": "Global Tech Solutions",
            "start": "2017",
            "end": "Present",
            "bullets": [
              "Led a team of 10+ engineers in the design and implementation of an MLOps platform on GCP, reducing model deployment time by 70%.",
              "Architected and implemented a robust CI/CD pipeline using Jenkins, Docker, and Kubeflow for ML models.",
              "Deployed and monitored ML models in a production environment, ensuring high availability, performance, and data quality.",
              "Mentored junior and mid-level engineers on best practices in MLOps and cloud-native architecture."
            ]
          },
          {
            "title": "Machine Learning Engineer",
            "company": "Advanced Analytics Inc.",
            "start": "2012",
            "end": "2017",
            "bullets": [
              "Designed and developed scalable data pipelines for ML model training and inference using Spark and Scala.",
              "Collaborated with data scientists to productionize models and integrate them into existing applications.",
              "Implemented model monitoring and logging with MLflow to track model performance and detect drift."
            ]
          }
        ],
        "education": [
          {
            "degree": "M.S.",
            "field": "Computer Science",
            "school": "Carnegie Mellon University",
            "year": "2012"
          },
          {
            "degree": "B.S.",
            "field": "Software Engineering",
            "school": "University of Michigan",
            "year": "2010"
          }
        ],
        "certifications": [
          "Google Professional Machine Learning Engineer"
        ],
        "raw_text": "Summary\nPrincipal Machine Learning Engineer with 12+ years of experience in leading the design, development, and deployment of complex ML systems. Expertise in MLOps, cloud-native architecture, and distributed systems. Proven ability to lead and mentor large, cross-functional teams and drive technical excellence.\n\nSkills\n\n* **Languages & Frameworks:** Python (TensorFlow, PyTorch), SQL, Scala, Bash\n* **Platforms & Tools:** Google Cloud Platform (GCP), Kubeflow, Docker, Kubernetes, Jenkins, Git\n* **Concepts:** MLOps, CI/CD, Model Deployment, Monitoring, Data Engineering, Distributed Systems\n* **Other:** Leadership, Strategic Planning, Mentorship, Problem-Solving\n\nExperience\n\n**Principal Machine Learning Engineer** | Global Tech Solutions | 2017 - Present\n* Led a team of 10+ engineers in the design and implementation of an MLOps platform on GCP, reducing model deployment time by 70%.\n* Architected and implemented a robust CI/CD pipeline using Jenkins, Docker, and Kubeflow for ML models.\n* Deployed and monitored ML models in a production environment, ensuring high availability, performance, and data quality.\n* Mentored junior and mid-level engineers on best practices in MLOps and cloud-native architecture.\n\n**Machine Learning Engineer** | Advanced Analytics Inc. | 2012 - 2017\n* Designed and developed scalable data pipelines for ML model training and inference using Spark and Scala.\n* Collaborated with data scientists to productionize models and integrate them into existing applications.\n* Implemented model monitoring and logging with MLflow to track model performance and detect drift.\n\nEducation\n\n**M.S. in Computer Science** | Carnegie Mellon University | 2012\n\n**B.S. in Software Engineering** | University of Michigan | 2010\n\nProjects & Certifications\n\n* **Certification:** Google Professional Machine Learning Engineer\n* **Project:** Led a company-wide initiative to migrate from a monolithic application to a microservices architecture for ML model serving.",
        "embed_meta": {
          "model": "team12-embedding",
          "fusion_version": "v1",
          "created_at": "2025-09-14T18:37:41Z",
          "tokens": 300
        }
      },
      "qa": [
        {
          "question": "Can you elaborate on your experience leading the design and implementation of an MLOps platform on GCP?",
          "answer": "As Principal Machine Learning Engineer at Global Tech Solutions, I led a team of 10+ engineers in designing and implementing an MLOps platform on GCP, reducing model deployment time by 70%. We utilized Kubeflow, Docker, and Kubernetes for containerization and orchestration."
        },
        {
          "question": "How would you compare your proficiency with TensorFlow and PyTorch? Do you have a preference for specific use cases?",
          "answer": "I have experience with both TensorFlow and PyTorch. While I'm proficient in both, I slightly prefer PyTorch for rapid prototyping and research due to its dynamic computation graph, whereas TensorFlow is often my choice for large-scale production environments due to its extensive support and tools."
        },
        {
          "question": "What role did your Google Professional Machine Learning Engineer certification play in your recent projects?",
          "answer": "My Google Professional Machine Learning Engineer certification has been valuable in validating my expertise and staying updated with best practices. It played a significant role in recent projects by ensuring my team's designs were aligned with industry standards for ML engineering on GCP."
        },
        {
          "question": "Can you describe a time when you had to mentor a junior engineer on MLOps best practices? How did you approach it?",
          "answer": "At Global Tech Solutions, I mentored junior and mid-level engineers on MLOps best practices, focusing on cloud-native architecture. I approached this through a combination of hands-on code reviews, design discussions, and knowledge-sharing sessions, ensuring they understood both theoretical foundations and practical implementations."
        },
        {
          "question": "How do you ensure the scalability and reliability of ML systems in production environments?",
          "answer": "To ensure scalability and reliability of ML systems in production, I emphasize robust CI/CD pipelines, continuous monitoring, and data quality checks. At Global Tech Solutions, we implemented a CI/CD pipeline using Jenkins, Docker, and Kubeflow, and used monitoring tools to track model performance and detect drift, ensuring high availability and performance."
        }
      ]
    },
    {
      "doc_id": "mle_senior_20",
      "scores": {
        "skills_score": 90,
        "experience_score": 95,
        "education_score": 90,
        "overall_score": 92,
        "reasons": {
          "skills": "Strong alignment with required skills, but lacks explicit mention of AWS, Azure, and MLflow.",
          "experience": "Extensive and relevant experience in MLOps and model deployment, exceeding the required 3-5 years.",
          "education": "Holds a Master's degree in Computer Science, meeting the requirement; Ph.D. is a plus but not mandatory.",
          "overall": "Highly qualified with strong skills, experience, and education; minor gaps in specific cloud platforms and tools."
        }
      },
      "candidate": {
        "doc_id": "mle_senior_20",
        "source_path": "synthetic://mle_senior_20.txt",
        "name": "James Rodriguez",
        "contact": {
          "email": "james.rodriguez@example.com",
          "phone": "+1-555-321-4567",
          "location": "Pittsburgh, USA",
          "linkedin": "https://www.linkedin.com/in/james-rodriguez-mle",
          "github": "https://github.com/jrodriguez-mle"
        },
        "skills": [
          "Python (TensorFlow, PyTorch)",
          "SQL",
          "Scala",
          "Bash",
          "Google Cloud Platform (GCP)",
          "Kubeflow",
          "Docker",
          "Kubernetes",
          "Jenkins",
          "Git",
          "MLOps",
          "CI/CD",
          "Model Deployment",
          "Monitoring",
          "Data Engineering",
          "Distributed Systems",
          "Leadership",
          "Strategic Planning",
          "Mentorship",
          "Problem-Solving"
        ],
        "experience": [
          {
            "title": "Principal Machine Learning Engineer",
            "company": "Global Tech Solutions",
            "start": "2017",
            "end": "Present",
            "bullets": [
              "Led a team of 10+ engineers in the design and implementation of an MLOps platform on GCP, reducing model deployment time by 70%.",
              "Architected and implemented a robust CI/CD pipeline using Jenkins, Docker, and Kubeflow for ML models.",
              "Deployed and monitored ML models in a production environment, ensuring high availability, performance, and data quality.",
              "Mentored junior and mid-level engineers on best practices in MLOps and cloud-native architecture."
            ]
          },
          {
            "title": "Machine Learning Engineer",
            "company": "Advanced Analytics Inc.",
            "start": "2012",
            "end": "2017",
            "bullets": [
              "Designed and developed scalable data pipelines for ML model training and inference using Spark and Scala.",
              "Collaborated with data scientists to productionize models and integrate them into existing applications.",
              "Implemented model monitoring and logging with MLflow to track model performance and detect drift."
            ]
          }
        ],
        "education": [
          {
            "degree": "M.S.",
            "field": "Computer Science",
            "school": "Carnegie Mellon University",
            "year": "2012"
          },
          {
            "degree": "B.S.",
            "field": "Software Engineering",
            "school": "University of Michigan",
            "year": "2010"
          }
        ],
        "certifications": [
          "Google Professional Machine Learning Engineer"
        ],
        "raw_text": "Summary\nPrincipal Machine Learning Engineer with 12+ years of experience in leading the design, development, and deployment of complex ML systems. Expertise in MLOps, cloud-native architecture, and distributed systems. Proven ability to lead and mentor large, cross-functional teams and drive technical excellence.\n\nSkills\n\n* **Languages & Frameworks:** Python (TensorFlow, PyTorch), SQL, Scala, Bash\n* **Platforms & Tools:** Google Cloud Platform (GCP), Kubeflow, Docker, Kubernetes, Jenkins, Git\n* **Concepts:** MLOps, CI/CD, Model Deployment, Monitoring, Data Engineering, Distributed Systems\n* **Other:** Leadership, Strategic Planning, Mentorship, Problem-Solving\n\nExperience\n\n**Principal Machine Learning Engineer** | Global Tech Solutions | 2017 - Present\n* Led a team of 10+ engineers in the design and implementation of an MLOps platform on GCP, reducing model deployment time by 70%.\n* Architected and implemented a robust CI/CD pipeline using Jenkins, Docker, and Kubeflow for ML models.\n* Deployed and monitored ML models in a production environment, ensuring high availability, performance, and data quality.\n* Mentored junior and mid-level engineers on best practices in MLOps and cloud-native architecture.\n\n**Machine Learning Engineer** | Advanced Analytics Inc. | 2012 - 2017\n* Designed and developed scalable data pipelines for ML model training and inference using Spark and Scala.\n* Collaborated with data scientists to productionize models and integrate them into existing applications.\n* Implemented model monitoring and logging with MLflow to track model performance and detect drift.\n\nEducation\n\n**M.S. in Computer Science** | Carnegie Mellon University | 2012\n\n**B.S. in Software Engineering** | University of Michigan | 2010\n\nProjects & Certifications\n\n* **Certification:** Google Professional Machine Learning Engineer\n* **Project:** Led a company-wide initiative to migrate from a monolithic application to a microservices architecture for ML model serving.",
        "embed_meta": {
          "model": "team12-embedding",
          "fusion_version": "v1",
          "created_at": "2025-09-14T18:37:41Z",
          "tokens": 300
        }
      },
      "qa": [
        {
          "question": "Can you elaborate on your experience leading the design and implementation of an MLOps platform on GCP?",
          "answer": "Led a team of 10+ engineers in designing and implementing an MLOps platform on GCP, reducing model deployment time by 70%."
        },
        {
          "question": "How would you compare your proficiency with TensorFlow and PyTorch, and which do you prefer for production use?",
          "answer": "Proficient in both TensorFlow and PyTorch; prefer PyTorch for rapid prototyping and TensorFlow for large-scale production environments."
        },
        {
          "question": "What challenges did you face while architecting CI/CD pipelines using Jenkins, Docker, and Kubeflow, and how did you overcome them?",
          "answer": "Faced challenges integrating Jenkins with Kubeflow; overcame them by leveraging Kubeflow's Jenkins plugin and custom scripting for seamless CI/CD pipeline orchestration."
        },
        {
          "question": "How has your Google Professional Machine Learning Engineer certification influenced your approach to model deployment and monitoring?",
          "answer": "The certification deepened my understanding of best practices in model deployment and monitoring, directly influencing my work on implementing robust model serving infrastructure."
        },
        {
          "question": "Can you describe a time when you mentored a junior engineer and the impact it had on their growth or the team's performance?",
          "answer": "Mentored junior engineers on MLOps best practices, resulting in improved team performance and their growth into more senior roles within the team."
        }
      ]
    },
    {
      "doc_id": "mle_senior_18",
      "scores": {
        "skills_score": 95,
        "experience_score": 90,
        "education_score": 90,
        "overall_score": 92,
        "reasons": {
          "skills": "Candidate demonstrates strong alignment with required skills, including Python, TensorFlow, PyTorch, Docker, Kubernetes, CI/CD, and cloud platforms (GCP). Missing explicit mention of AWS and Azure.",
          "experience": "Over 10 years of relevant experience, including leadership in MLOps and model deployment. Slight penalty for exceeding the specified range (3-5 years).",
          "education": "Holds an M.S. in Computer Science, which meets the requirement. No Ph.D., which is listed as a plus.",
          "overall": "Highly qualified with strong skills, relevant experience, and appropriate education. Slight deductions for missing AWS/Azure and exceeding experience range."
        }
      },
      "candidate": {
        "doc_id": "mle_senior_18",
        "source_path": "synthetic://mle_senior_18.txt",
        "name": "James Rodriguez",
        "contact": {
          "email": "james.rodriguez@example.com",
          "phone": "+1-555-321-4567",
          "location": "Pittsburgh, USA",
          "linkedin": "https://www.linkedin.com/in/james-rodriguez-mle",
          "github": "https://github.com/jrodriguez-mle"
        },
        "skills": [
          "Python (TensorFlow, PyTorch)",
          "SQL",
          "Scala",
          "Bash",
          "Google Cloud Platform (GCP)",
          "Kubeflow",
          "Docker",
          "Kubernetes",
          "Jenkins",
          "Git",
          "MLOps",
          "CI/CD",
          "Model Deployment",
          "Monitoring",
          "Data Engineering",
          "Distributed Systems",
          "Leadership",
          "Strategic Planning",
          "Mentorship",
          "Problem-Solving"
        ],
        "experience": [
          {
            "title": "Principal Machine Learning Engineer",
            "company": "Global Tech Solutions",
            "start": "2017",
            "end": "Present",
            "bullets": [
              "Led a team of 10+ engineers in the design and implementation of an MLOps platform on GCP, reducing model deployment time by 70%.",
              "Architected and implemented a robust CI/CD pipeline using Jenkins, Docker, and Kubeflow for ML models.",
              "Deployed and monitored ML models in a production environment, ensuring high availability, performance, and data quality.",
              "Mentored junior and mid-level engineers on best practices in MLOps and cloud-native architecture."
            ]
          },
          {
            "title": "Machine Learning Engineer",
            "company": "Advanced Analytics Inc.",
            "start": "2012",
            "end": "2017",
            "bullets": [
              "Designed and developed scalable data pipelines for ML model training and inference using Spark and Scala.",
              "Collaborated with data scientists to productionize models and integrate them into existing applications.",
              "Implemented model monitoring and logging with MLflow to track model performance and detect drift."
            ]
          }
        ],
        "education": [
          {
            "degree": "M.S.",
            "field": "Computer Science",
            "school": "Carnegie Mellon University",
            "year": "2012"
          },
          {
            "degree": "B.S.",
            "field": "Software Engineering",
            "school": "University of Michigan",
            "year": "2010"
          }
        ],
        "certifications": [
          "Google Professional Machine Learning Engineer"
        ],
        "raw_text": "Summary\nPrincipal Machine Learning Engineer with 12+ years of experience in leading the design, development, and deployment of complex ML systems. Expertise in MLOps, cloud-native architecture, and distributed systems. Proven ability to lead and mentor large, cross-functional teams and drive technical excellence.\n\nSkills\n\n* **Languages & Frameworks:** Python (TensorFlow, PyTorch), SQL, Scala, Bash\n* **Platforms & Tools:** Google Cloud Platform (GCP), Kubeflow, Docker, Kubernetes, Jenkins, Git\n* **Concepts:** MLOps, CI/CD, Model Deployment, Monitoring, Data Engineering, Distributed Systems\n* **Other:** Leadership, Strategic Planning, Mentorship, Problem-Solving\n\nExperience\n\n**Principal Machine Learning Engineer** | Global Tech Solutions | 2017 - Present\n* Led a team of 10+ engineers in the design and implementation of an MLOps platform on GCP, reducing model deployment time by 70%.\n* Architected and implemented a robust CI/CD pipeline using Jenkins, Docker, and Kubeflow for ML models.\n* Deployed and monitored ML models in a production environment, ensuring high availability, performance, and data quality.\n* Mentored junior and mid-level engineers on best practices in MLOps and cloud-native architecture.\n\n**Machine Learning Engineer** | Advanced Analytics Inc. | 2012 - 2017\n* Designed and developed scalable data pipelines for ML model training and inference using Spark and Scala.\n* Collaborated with data scientists to productionize models and integrate them into existing applications.\n* Implemented model monitoring and logging with MLflow to track model performance and detect drift.\n\nEducation\n\n**M.S. in Computer Science** | Carnegie Mellon University | 2012\n\n**B.S. in Software Engineering** | University of Michigan | 2010\n\nProjects & Certifications\n\n* **Certification:** Google Professional Machine Learning Engineer\n* **Project:** Led a company-wide initiative to migrate from a monolithic application to a microservices architecture for ML model serving.",
        "embed_meta": {
          "model": "team12-embedding",
          "fusion_version": "v1",
          "created_at": "2025-09-14T18:37:41Z",
          "tokens": 300
        }
      },
      "qa": [
        {
          "question": "Can you elaborate on your experience leading the design and implementation of an MLOps platform on GCP?",
          "answer": "As Principal Machine Learning Engineer at Global Tech Solutions, I led a team of 10+ engineers in designing and implementing an MLOps platform on GCP, reducing model deployment time by 70%."
        },
        {
          "question": "What challenges did you face while architecting CI/CD pipelines with Jenkins, Docker, and Kubeflow, and how did you overcome them?",
          "answer": "While architecting CI/CD pipelines with Jenkins, Docker, and Kubeflow, we faced challenges with integration and scalability. We overcame them by implementing a modular pipeline design and leveraging Kubeflow's scalability features."
        },
        {
          "question": "How has your Google Professional Machine Learning Engineer certification influenced your approach to model deployment and monitoring?",
          "answer": "My Google Professional Machine Learning Engineer certification deepened my understanding of best practices in model deployment and monitoring. It influenced my approach to designing robust, scalable ML systems."
        },
        {
          "question": "Can you share an example of mentoring junior engineers and the impact it had on the team or project outcomes?",
          "answer": "I mentored junior engineers on MLOps and cloud-native architecture best practices. This improved the team's overall technical capabilities and led to more efficient model deployment and maintenance."
        },
        {
          "question": "What strategies do you use to ensure high availability and performance for ML models in production environments?",
          "answer": "To ensure high availability and performance for ML models, I implement strategies such as model monitoring with MLflow, containerization with Docker, and orchestration with Kubernetes, ensuring scalable and reliable model serving."
        }
      ]
    },
    {
      "doc_id": "mle_senior_12",
      "scores": {
        "skills_score": 90,
        "experience_score": 95,
        "education_score": 90,
        "overall_score": 92,
        "reasons": {
          "skills": "Strong match with required skills, but lacks explicit mention of AWS, Azure, and MLflow.",
          "experience": "Exceeds the required experience with 12+ years, including leadership in MLOps and model deployment.",
          "education": "Holds a Master's in Computer Science, meeting the requirement; no Ph.D. but not mandatory.",
          "overall": "Highly qualified with minor gaps in specific cloud platforms and tools."
        }
      },
      "candidate": {
        "doc_id": "mle_senior_12",
        "source_path": "synthetic://mle_senior_12.txt",
        "name": "James Rodriguez",
        "contact": {
          "email": "james.rodriguez@example.com",
          "phone": "+1-555-321-4567",
          "location": "Pittsburgh, USA",
          "linkedin": "https://www.linkedin.com/in/james-rodriguez-mle",
          "github": "https://github.com/jrodriguez-mle"
        },
        "skills": [
          "Python (TensorFlow, PyTorch)",
          "SQL",
          "Scala",
          "Bash",
          "Google Cloud Platform (GCP)",
          "Kubeflow",
          "Docker",
          "Kubernetes",
          "Jenkins",
          "Git",
          "MLOps",
          "CI/CD",
          "Model Deployment",
          "Monitoring",
          "Data Engineering",
          "Distributed Systems",
          "Leadership",
          "Strategic Planning",
          "Mentorship",
          "Problem-Solving"
        ],
        "experience": [
          {
            "title": "Principal Machine Learning Engineer",
            "company": "Global Tech Solutions",
            "start": "2017",
            "end": "Present",
            "bullets": [
              "Led a team of 10+ engineers in the design and implementation of an MLOps platform on GCP, reducing model deployment time by 70%.",
              "Architected and implemented a robust CI/CD pipeline using Jenkins, Docker, and Kubeflow for ML models.",
              "Deployed and monitored ML models in a production environment, ensuring high availability, performance, and data quality.",
              "Mentored junior and mid-level engineers on best practices in MLOps and cloud-native architecture."
            ]
          },
          {
            "title": "Machine Learning Engineer",
            "company": "Advanced Analytics Inc.",
            "start": "2012",
            "end": "2017",
            "bullets": [
              "Designed and developed scalable data pipelines for ML model training and inference using Spark and Scala.",
              "Collaborated with data scientists to productionize models and integrate them into existing applications.",
              "Implemented model monitoring and logging with MLflow to track model performance and detect drift."
            ]
          }
        ],
        "education": [
          {
            "degree": "M.S.",
            "field": "Computer Science",
            "school": "Carnegie Mellon University",
            "year": "2012"
          },
          {
            "degree": "B.S.",
            "field": "Software Engineering",
            "school": "University of Michigan",
            "year": "2010"
          }
        ],
        "certifications": [
          "Google Professional Machine Learning Engineer"
        ],
        "raw_text": "Summary\nPrincipal Machine Learning Engineer with 12+ years of experience in leading the design, development, and deployment of complex ML systems. Expertise in MLOps, cloud-native architecture, and distributed systems. Proven ability to lead and mentor large, cross-functional teams and drive technical excellence.\n\nSkills\n\n* **Languages & Frameworks:** Python (TensorFlow, PyTorch), SQL, Scala, Bash\n* **Platforms & Tools:** Google Cloud Platform (GCP), Kubeflow, Docker, Kubernetes, Jenkins, Git\n* **Concepts:** MLOps, CI/CD, Model Deployment, Monitoring, Data Engineering, Distributed Systems\n* **Other:** Leadership, Strategic Planning, Mentorship, Problem-Solving\n\nExperience\n\n**Principal Machine Learning Engineer** | Global Tech Solutions | 2017 - Present\n* Led a team of 10+ engineers in the design and implementation of an MLOps platform on GCP, reducing model deployment time by 70%.\n* Architected and implemented a robust CI/CD pipeline using Jenkins, Docker, and Kubeflow for ML models.\n* Deployed and monitored ML models in a production environment, ensuring high availability, performance, and data quality.\n* Mentored junior and mid-level engineers on best practices in MLOps and cloud-native architecture.\n\n**Machine Learning Engineer** | Advanced Analytics Inc. | 2012 - 2017\n* Designed and developed scalable data pipelines for ML model training and inference using Spark and Scala.\n* Collaborated with data scientists to productionize models and integrate them into existing applications.\n* Implemented model monitoring and logging with MLflow to track model performance and detect drift.\n\nEducation\n\n**M.S. in Computer Science** | Carnegie Mellon University | 2012\n\n**B.S. in Software Engineering** | University of Michigan | 2010\n\nProjects & Certifications\n\n* **Certification:** Google Professional Machine Learning Engineer\n* **Project:** Led a company-wide initiative to migrate from a monolithic application to a microservices architecture for ML model serving.",
        "embed_meta": {
          "model": "team12-embedding",
          "fusion_version": "v1",
          "created_at": "2025-09-14T18:37:41Z",
          "tokens": 300
        }
      },
      "qa": [
        {
          "question": "Can you elaborate on your experience leading the design and implementation of an MLOps platform on GCP?",
          "answer": "As Principal Machine Learning Engineer at Global Tech Solutions, I led a team of 10+ engineers in designing and implementing an MLOps platform on GCP, reducing model deployment time by 70%."
        },
        {
          "question": "How would you compare your proficiency in TensorFlow and PyTorch? Do you have a preference for certain use cases?",
          "answer": "I am proficient in both TensorFlow and PyTorch, having used them in various projects. While I don't have a strong preference, I tend to use PyTorch for rapid prototyping and TensorFlow for large-scale deployments."
        },
        {
          "question": "What challenges did you face while architecting CI/CD pipelines using Jenkins, Docker, and Kubeflow, and how did you overcome them?",
          "answer": "While architecting CI/CD pipelines using Jenkins, Docker, and Kubeflow, we faced challenges with container orchestration and pipeline reliability. We overcame these by implementing robust monitoring and logging, and optimizing our Docker images for faster deployment."
        },
        {
          "question": "Do you hold any additional certifications or training related to AWS or Azure, beyond your GCP expertise?",
          "answer": "I hold a Google Professional Machine Learning Engineer certification, but I don't have additional certifications or training related to AWS or Azure. However, I am familiar with their services through industry knowledge and previous exposure."
        },
        {
          "question": "Can you describe a time when you mentored a junior engineer and the impact it had on their development or the team's success?",
          "answer": "I mentored junior engineers at Global Tech Solutions, guiding them on best practices in MLOps and cloud-native architecture. One junior engineer improved significantly, taking on more complex tasks and contributing to the team's success by implementing a more efficient model deployment strategy."
        }
      ]
    },
    {
      "doc_id": "mle_senior_14",
      "scores": {
        "skills_score": 90,
        "experience_score": 95,
        "education_score": 90,
        "overall_score": 92,
        "reasons": {
          "skills": "Strong alignment with required skills, but lacks explicit mention of AWS, Azure, and MLflow.",
          "experience": "Extensive and relevant experience in MLOps and model deployment, exceeding the required 3-5 years.",
          "education": "Holds a Master's in Computer Science, meeting the requirements; no Ph.D., which is a plus.",
          "overall": "Highly qualified with strong skills, experience, and education; minor gaps in specific tools and certifications."
        }
      },
      "candidate": {
        "doc_id": "mle_senior_14",
        "source_path": "synthetic://mle_senior_14.txt",
        "name": "James Rodriguez",
        "contact": {
          "email": "james.rodriguez@example.com",
          "phone": "+1-555-321-4567",
          "location": "Pittsburgh, USA",
          "linkedin": "https://www.linkedin.com/in/james-rodriguez-mle",
          "github": "https://github.com/jrodriguez-mle"
        },
        "skills": [
          "Python (TensorFlow, PyTorch)",
          "SQL",
          "Scala",
          "Bash",
          "Google Cloud Platform (GCP)",
          "Kubeflow",
          "Docker",
          "Kubernetes",
          "Jenkins",
          "Git",
          "MLOps",
          "CI/CD",
          "Model Deployment",
          "Monitoring",
          "Data Engineering",
          "Distributed Systems",
          "Leadership",
          "Strategic Planning",
          "Mentorship",
          "Problem-Solving"
        ],
        "experience": [
          {
            "title": "Principal Machine Learning Engineer",
            "company": "Global Tech Solutions",
            "start": "2017",
            "end": "Present",
            "bullets": [
              "Led a team of 10+ engineers in the design and implementation of an MLOps platform on GCP, reducing model deployment time by 70%.",
              "Architected and implemented a robust CI/CD pipeline using Jenkins, Docker, and Kubeflow for ML models.",
              "Deployed and monitored ML models in a production environment, ensuring high availability, performance, and data quality.",
              "Mentored junior and mid-level engineers on best practices in MLOps and cloud-native architecture."
            ]
          },
          {
            "title": "Machine Learning Engineer",
            "company": "Advanced Analytics Inc.",
            "start": "2012",
            "end": "2017",
            "bullets": [
              "Designed and developed scalable data pipelines for ML model training and inference using Spark and Scala.",
              "Collaborated with data scientists to productionize models and integrate them into existing applications.",
              "Implemented model monitoring and logging with MLflow to track model performance and detect drift."
            ]
          }
        ],
        "education": [
          {
            "degree": "M.S.",
            "field": "Computer Science",
            "school": "Carnegie Mellon University",
            "year": "2012"
          },
          {
            "degree": "B.S.",
            "field": "Software Engineering",
            "school": "University of Michigan",
            "year": "2010"
          }
        ],
        "certifications": [
          "Google Professional Machine Learning Engineer"
        ],
        "raw_text": "Summary\nPrincipal Machine Learning Engineer with 12+ years of experience in leading the design, development, and deployment of complex ML systems. Expertise in MLOps, cloud-native architecture, and distributed systems. Proven ability to lead and mentor large, cross-functional teams and drive technical excellence.\n\nSkills\n\n* **Languages & Frameworks:** Python (TensorFlow, PyTorch), SQL, Scala, Bash\n* **Platforms & Tools:** Google Cloud Platform (GCP), Kubeflow, Docker, Kubernetes, Jenkins, Git\n* **Concepts:** MLOps, CI/CD, Model Deployment, Monitoring, Data Engineering, Distributed Systems\n* **Other:** Leadership, Strategic Planning, Mentorship, Problem-Solving\n\nExperience\n\n**Principal Machine Learning Engineer** | Global Tech Solutions | 2017 - Present\n* Led a team of 10+ engineers in the design and implementation of an MLOps platform on GCP, reducing model deployment time by 70%.\n* Architected and implemented a robust CI/CD pipeline using Jenkins, Docker, and Kubeflow for ML models.\n* Deployed and monitored ML models in a production environment, ensuring high availability, performance, and data quality.\n* Mentored junior and mid-level engineers on best practices in MLOps and cloud-native architecture.\n\n**Machine Learning Engineer** | Advanced Analytics Inc. | 2012 - 2017\n* Designed and developed scalable data pipelines for ML model training and inference using Spark and Scala.\n* Collaborated with data scientists to productionize models and integrate them into existing applications.\n* Implemented model monitoring and logging with MLflow to track model performance and detect drift.\n\nEducation\n\n**M.S. in Computer Science** | Carnegie Mellon University | 2012\n\n**B.S. in Software Engineering** | University of Michigan | 2010\n\nProjects & Certifications\n\n* **Certification:** Google Professional Machine Learning Engineer\n* **Project:** Led a company-wide initiative to migrate from a monolithic application to a microservices architecture for ML model serving.",
        "embed_meta": {
          "model": "team12-embedding",
          "fusion_version": "v1",
          "created_at": "2025-09-14T18:37:41Z",
          "tokens": 300
        }
      },
      "qa": [
        {
          "question": "Can you elaborate on your experience leading the design and implementation of an MLOps platform on GCP?",
          "answer": "Led a team of 10+ engineers in designing and implementing an MLOps platform on GCP, reducing model deployment time by 70%."
        },
        {
          "question": "What challenges did you face when architecting CI/CD pipelines with Jenkins, Docker, and Kubeflow, and how did you overcome them?",
          "answer": "When architecting CI/CD pipelines with Jenkins, Docker, and Kubeflow, I faced challenges related to integration and scalability. I overcame them by leveraging containerization and orchestration capabilities, ensuring seamless integration and efficient resource utilization."
        },
        {
          "question": "How have you utilized your Google Professional Machine Learning Engineer certification in your recent projects?",
          "answer": "I've utilized my Google Professional Machine Learning Engineer certification to validate my expertise and stay updated on best practices. While I don't have a specific recent project to point to, it has influenced my approach to designing and deploying ML models on GCP."
        },
        {
          "question": "Can you describe a time when you mentored junior engineers and the impact it had on the team or project outcomes?",
          "answer": "I mentored junior and mid-level engineers on best practices in MLOps and cloud-native architecture. This mentorship improved the team's overall technical capabilities and contributed to the successful deployment of ML models."
        },
        {
          "question": "What strategies do you use to ensure high availability and performance of ML models in production environments?",
          "answer": "To ensure high availability and performance of ML models, I implement robust monitoring, logging, and model serving strategies. This includes using tools like Kubeflow for model deployment and monitoring model performance to detect drift or issues."
        }
      ]
    },
    {
      "doc_id": "mle_senior_10",
      "scores": {
        "skills_score": 90,
        "experience_score": 95,
        "education_score": 90,
        "overall_score": 92,
        "reasons": {
          "skills": "Strong alignment with required skills, but lacks explicit mention of AWS, Azure, and MLflow.",
          "experience": "Extensive and relevant experience in MLOps and model deployment, exceeding the required 3-5 years.",
          "education": "Holds a Master's in Computer Science, meeting the requirement; no Ph.D., which is a plus.",
          "overall": "Highly qualified with strong skills, experience, and education; minor gaps in specific cloud platforms and tools."
        }
      },
      "candidate": {
        "doc_id": "mle_senior_10",
        "source_path": "synthetic://mle_senior_10.txt",
        "name": "James Rodriguez",
        "contact": {
          "email": "james.rodriguez@example.com",
          "phone": "+1-555-321-4567",
          "location": "Pittsburgh, USA",
          "linkedin": "https://www.linkedin.com/in/james-rodriguez-mle",
          "github": "https://github.com/jrodriguez-mle"
        },
        "skills": [
          "Python (TensorFlow, PyTorch)",
          "SQL",
          "Scala",
          "Bash",
          "Google Cloud Platform (GCP)",
          "Kubeflow",
          "Docker",
          "Kubernetes",
          "Jenkins",
          "Git",
          "MLOps",
          "CI/CD",
          "Model Deployment",
          "Monitoring",
          "Data Engineering",
          "Distributed Systems",
          "Leadership",
          "Strategic Planning",
          "Mentorship",
          "Problem-Solving"
        ],
        "experience": [
          {
            "title": "Principal Machine Learning Engineer",
            "company": "Global Tech Solutions",
            "start": "2017",
            "end": "Present",
            "bullets": [
              "Led a team of 10+ engineers in the design and implementation of an MLOps platform on GCP, reducing model deployment time by 70%.",
              "Architected and implemented a robust CI/CD pipeline using Jenkins, Docker, and Kubeflow for ML models.",
              "Deployed and monitored ML models in a production environment, ensuring high availability, performance, and data quality.",
              "Mentored junior and mid-level engineers on best practices in MLOps and cloud-native architecture."
            ]
          },
          {
            "title": "Machine Learning Engineer",
            "company": "Advanced Analytics Inc.",
            "start": "2012",
            "end": "2017",
            "bullets": [
              "Designed and developed scalable data pipelines for ML model training and inference using Spark and Scala.",
              "Collaborated with data scientists to productionize models and integrate them into existing applications.",
              "Implemented model monitoring and logging with MLflow to track model performance and detect drift."
            ]
          }
        ],
        "education": [
          {
            "degree": "M.S.",
            "field": "Computer Science",
            "school": "Carnegie Mellon University",
            "year": "2012"
          },
          {
            "degree": "B.S.",
            "field": "Software Engineering",
            "school": "University of Michigan",
            "year": "2010"
          }
        ],
        "certifications": [
          "Google Professional Machine Learning Engineer"
        ],
        "raw_text": "Summary\nPrincipal Machine Learning Engineer with 12+ years of experience in leading the design, development, and deployment of complex ML systems. Expertise in MLOps, cloud-native architecture, and distributed systems. Proven ability to lead and mentor large, cross-functional teams and drive technical excellence.\n\nSkills\n\n* **Languages & Frameworks:** Python (TensorFlow, PyTorch), SQL, Scala, Bash\n* **Platforms & Tools:** Google Cloud Platform (GCP), Kubeflow, Docker, Kubernetes, Jenkins, Git\n* **Concepts:** MLOps, CI/CD, Model Deployment, Monitoring, Data Engineering, Distributed Systems\n* **Other:** Leadership, Strategic Planning, Mentorship, Problem-Solving\n\nExperience\n\n**Principal Machine Learning Engineer** | Global Tech Solutions | 2017 - Present\n* Led a team of 10+ engineers in the design and implementation of an MLOps platform on GCP, reducing model deployment time by 70%.\n* Architected and implemented a robust CI/CD pipeline using Jenkins, Docker, and Kubeflow for ML models.\n* Deployed and monitored ML models in a production environment, ensuring high availability, performance, and data quality.\n* Mentored junior and mid-level engineers on best practices in MLOps and cloud-native architecture.\n\n**Machine Learning Engineer** | Advanced Analytics Inc. | 2012 - 2017\n* Designed and developed scalable data pipelines for ML model training and inference using Spark and Scala.\n* Collaborated with data scientists to productionize models and integrate them into existing applications.\n* Implemented model monitoring and logging with MLflow to track model performance and detect drift.\n\nEducation\n\n**M.S. in Computer Science** | Carnegie Mellon University | 2012\n\n**B.S. in Software Engineering** | University of Michigan | 2010\n\nProjects & Certifications\n\n* **Certification:** Google Professional Machine Learning Engineer\n* **Project:** Led a company-wide initiative to migrate from a monolithic application to a microservices architecture for ML model serving.",
        "embed_meta": {
          "model": "team12-embedding",
          "fusion_version": "v1",
          "created_at": "2025-09-14T18:37:41Z",
          "tokens": 300
        }
      },
      "qa": [
        {
          "question": "Can you elaborate on your experience leading the design and implementation of an MLOps platform on GCP?",
          "answer": "As Principal Machine Learning Engineer at Global Tech Solutions, I led a team of 10+ engineers in designing and implementing an MLOps platform on GCP, reducing model deployment time by 70%."
        },
        {
          "question": "What challenges did you face while architecting CI/CD pipelines with Jenkins, Docker, and Kubeflow, and how did you overcome them?",
          "answer": "While architecting CI/CD pipelines with Jenkins, Docker, and Kubeflow, we faced challenges with pipeline reliability and model versioning. We overcame these by implementing robust testing and validation, and using Kubeflow's built-in versioning and rollback features."
        },
        {
          "question": "How has your Google Professional Machine Learning Engineer certification influenced your approach to model deployment and monitoring?",
          "answer": "My Google Professional Machine Learning Engineer certification deepened my understanding of best practices in model deployment and monitoring. It influenced my approach to designing scalable and reliable ML systems, and informed my decisions when implementing model monitoring and logging with MLflow."
        },
        {
          "question": "Can you describe a time when you mentored a junior engineer and the impact it had on their growth or the team's performance?",
          "answer": "I mentored junior engineers on best practices in MLOps and cloud-native architecture. One junior engineer improved significantly after guidance on designing scalable data pipelines and implementing CI/CD pipelines, which positively impacted the team's overall performance."
        },
        {
          "question": "How do you ensure scalability and reliability in the ML systems you design and deploy?",
          "answer": "To ensure scalability and reliability, I design ML systems with distributed architectures, leveraging tools like Kubernetes and Docker. I also implement robust monitoring and logging, using tools like MLflow to track model performance and detect drift, ensuring high availability and performance in production environments."
        }
      ]
    },
    {
      "doc_id": "mle_senior_08",
      "scores": {
        "skills_score": 85,
        "experience_score": 90,
        "education_score": 95,
        "overall_score": 88,
        "reasons": {
          "skills": "Strong in Python, TensorFlow, PyTorch, GCP, Docker, Kubernetes, CI/CD, Kubeflow, and problem-solving, but lacks direct experience with AWS, Azure, and MLflow is limited.",
          "experience": "Exceeds the required 3-5 years with 12+ years of relevant experience, including leadership in MLOps and model deployment.",
          "education": "Holds an M.S. in Computer Science, which exceeds the Bachelor's requirement; no Ph.D., but it's only a plus.",
          "overall": "Highly qualified with strong skills, extensive experience, and excellent education, but minor gaps in AWS/Azure and MLflow usage."
        }
      },
      "candidate": {
        "doc_id": "mle_senior_08",
        "source_path": "synthetic://mle_senior_08.txt",
        "name": "James Rodriguez",
        "contact": {
          "email": "james.rodriguez@example.com",
          "phone": "+1-555-321-4567",
          "location": "Pittsburgh, USA",
          "linkedin": "https://www.linkedin.com/in/james-rodriguez-mle",
          "github": "https://github.com/jrodriguez-mle"
        },
        "skills": [
          "Python (TensorFlow, PyTorch)",
          "SQL",
          "Scala",
          "Bash",
          "Google Cloud Platform (GCP)",
          "Kubeflow",
          "Docker",
          "Kubernetes",
          "Jenkins",
          "Git",
          "MLOps",
          "CI/CD",
          "Model Deployment",
          "Monitoring",
          "Data Engineering",
          "Distributed Systems",
          "Leadership",
          "Strategic Planning",
          "Mentorship",
          "Problem-Solving"
        ],
        "experience": [
          {
            "title": "Principal Machine Learning Engineer",
            "company": "Global Tech Solutions",
            "start": "2017",
            "end": "Present",
            "bullets": [
              "Led a team of 10+ engineers in the design and implementation of an MLOps platform on GCP, reducing model deployment time by 70%.",
              "Architected and implemented a robust CI/CD pipeline using Jenkins, Docker, and Kubeflow for ML models.",
              "Deployed and monitored ML models in a production environment, ensuring high availability, performance, and data quality.",
              "Mentored junior and mid-level engineers on best practices in MLOps and cloud-native architecture."
            ]
          },
          {
            "title": "Machine Learning Engineer",
            "company": "Advanced Analytics Inc.",
            "start": "2012",
            "end": "2017",
            "bullets": [
              "Designed and developed scalable data pipelines for ML model training and inference using Spark and Scala.",
              "Collaborated with data scientists to productionize models and integrate them into existing applications.",
              "Implemented model monitoring and logging with MLflow to track model performance and detect drift."
            ]
          }
        ],
        "education": [
          {
            "degree": "M.S.",
            "field": "Computer Science",
            "school": "Carnegie Mellon University",
            "year": "2012"
          },
          {
            "degree": "B.S.",
            "field": "Software Engineering",
            "school": "University of Michigan",
            "year": "2010"
          }
        ],
        "certifications": [
          "Google Professional Machine Learning Engineer"
        ],
        "raw_text": "Summary\nPrincipal Machine Learning Engineer with 12+ years of experience in leading the design, development, and deployment of complex ML systems. Expertise in MLOps, cloud-native architecture, and distributed systems. Proven ability to lead and mentor large, cross-functional teams and drive technical excellence.\n\nSkills\n\n* **Languages & Frameworks:** Python (TensorFlow, PyTorch), SQL, Scala, Bash\n* **Platforms & Tools:** Google Cloud Platform (GCP), Kubeflow, Docker, Kubernetes, Jenkins, Git\n* **Concepts:** MLOps, CI/CD, Model Deployment, Monitoring, Data Engineering, Distributed Systems\n* **Other:** Leadership, Strategic Planning, Mentorship, Problem-Solving\n\nExperience\n\n**Principal Machine Learning Engineer** | Global Tech Solutions | 2017 - Present\n* Led a team of 10+ engineers in the design and implementation of an MLOps platform on GCP, reducing model deployment time by 70%.\n* Architected and implemented a robust CI/CD pipeline using Jenkins, Docker, and Kubeflow for ML models.\n* Deployed and monitored ML models in a production environment, ensuring high availability, performance, and data quality.\n* Mentored junior and mid-level engineers on best practices in MLOps and cloud-native architecture.\n\n**Machine Learning Engineer** | Advanced Analytics Inc. | 2012 - 2017\n* Designed and developed scalable data pipelines for ML model training and inference using Spark and Scala.\n* Collaborated with data scientists to productionize models and integrate them into existing applications.\n* Implemented model monitoring and logging with MLflow to track model performance and detect drift.\n\nEducation\n\n**M.S. in Computer Science** | Carnegie Mellon University | 2012\n\n**B.S. in Software Engineering** | University of Michigan | 2010\n\nProjects & Certifications\n\n* **Certification:** Google Professional Machine Learning Engineer\n* **Project:** Led a company-wide initiative to migrate from a monolithic application to a microservices architecture for ML model serving.",
        "embed_meta": {
          "model": "team12-embedding",
          "fusion_version": "v1",
          "created_at": "2025-09-14T18:37:41Z",
          "tokens": 300
        }
      },
      "qa": [
        {
          "question": "Can you elaborate on the MLOps platform you designed on GCP and how it reduced model deployment time by 70%?",
          "answer": "I led a team in designing and implementing an MLOps platform on GCP, which included automating model testing, deployment, and monitoring. This reduced model deployment time by 70% by streamlining processes and leveraging Kubeflow for orchestration."
        },
        {
          "question": "What challenges did you face while implementing the CI/CD pipeline with Jenkins, Docker, and Kubeflow, and how did you overcome them?",
          "answer": "Implementing the CI/CD pipeline with Jenkins, Docker, and Kubeflow presented challenges such as ensuring containerization consistency and managing dependencies. We overcame these by standardizing Docker images and using Jenkins for automated testing and deployment."
        },
        {
          "question": "How have you utilized MLflow for model monitoring and drift detection in your previous roles?",
          "answer": "At Advanced Analytics Inc., I used MLflow to track model performance and detect drift by logging model metrics and comparing them against baseline values. This allowed for proactive model retraining and maintenance."
        },
        {
          "question": "What is your experience with AWS and Azure, given your strong background in GCP?",
          "answer": "While my primary experience is with GCP, I have some exposure to AWS and Azure through industry conferences and personal projects. However, I haven't worked extensively with them in a professional capacity."
        },
        {
          "question": "Can you describe a time when you had to mentor a junior engineer on MLOps best practices? What approach did you take?",
          "answer": "I mentored junior engineers by providing hands-on guidance on MLOps best practices, such as using Kubeflow for model deployment and monitoring. My approach included code reviews, pair programming, and sharing relevant documentation and resources."
        }
      ]
    }
  ]
}